sourceId,citationLabel,url,priorClass,modelUse,modelBoundary,implementedHook,coreStatus,notes
MoTe2_pressure_NatCommun2016,"Qi et al., Nature Communications 7, 11038 (2016)",https://www.nature.com/articles/ncomms11038,MoTe2 superconducting scale,"Justifies low unenhanced Tc baseline, bounded enhanced local Tc population, and strong lattice sensitivity.",Do not convert hydrostatic pressure directly into local uniaxial strain in the lithographic stressor geometry.,Tc baseline/enhanced bounds and correlated mechanical/Raman proxy fields.,implemented_as_prior,"Use to bound local Tc ranges and motivate mechanical coupling, not to infer a unique Tc(epsilon) law."
MoTe2_pressure_NatCommun2016_duplicate,"Duplicate user-provided Nature Communications 7, 11038 source",https://www.nature.com/articles/ncomms11038,Duplicate source bookkeeping,"Stored once in analysis; retained here only to preserve the user-provided reference list.",Do not double-weight the same Nature Communications source.,Reference-table duplicate flag only.,bookkeeping_only,"Items 1 and 2 in the user list are identical links."
MoTe2_gap_pointcontact_arXiv1805_02470,"MoTe2 point-contact spectroscopy / gap-ratio prior, arXiv:1805.02470",https://arxiv.org/abs/1805.02470,Gap and weak-link scale,"Provides a narrow prior for alpha_gap = 2 Delta / kB Tc near 3.7 +/- 0.4.",Do not claim the local strained domains have directly measured gaps unless device-specific spectroscopy exists.,v7.4.6/v7.5 alpha_gap sweep and gap-derived Ic scale.,implemented_as_prior,"This prior narrows alpha_gap but should remain shared/global, not link-by-link."
Ambegaokar_Baratoff_OSTI4700205,"Ambegaokar and Baratoff tunnel-junction IcRn relation",https://www.osti.gov/biblio/4700205,Tunnel weak-link critical current,"Constrains tunnel-like weak-link Ic Rn(T) instead of allowing independent arbitrary Ic per link.",Use as a tunnel/crack-like hypothesis; continuous intraflake regions may be SNS/constriction-like instead.,v7.4.6/v7.5 AB-like IcRn scale for crack/tunnel-like links.,implemented_as_model_hypothesis,"Good for low-transparency links; SNS/constriction links should use a separate normalized class factor."
MoTe2_edge_supercurrent_OSTI1803173,"MoTe2 edge-supercurrent / field-oscillation study, OSTI 1803173",https://www.osti.gov/biblio/1803173,Field/phase limitation,"Motivates edge/loop/weak-link field sensitivity while marking phase-coherent oscillations as outside the resistor-network core.",Do not tune a scalar field-resistance term to reproduce oscillation periods; a phase-aware Josephson module would be required.,v7.5 hypothesis boundary: field oscillations are not part of the core fitted score.,explicitly_out_of_scope_for_core_model,"Safe thesis framing: the present network can discuss suppression/envelope trends, not fluxoid-period extraction."
